{
  "$schema": "https://json-schema.org/draft/2020-12/schema",
  "$id": "https://github.com/mapan0424/image-to-pptx-ir/raw/main/schemas/semantic.schema.json",
  "title": "Image-to-PPTX Semantic Document",
  "type": "object",
  "required": ["title", "regions"],
  "properties": {
    "title": { "type": "string", "minLength": 1 },
    "pageIntent": { "type": "string" },
    "keyMessages": {
      "type": "array",
      "items": { "type": "string" }
    },
    "regions": {
      "type": "array",
      "minItems": 1,
      "items": {
        "type": "object",
        "required": ["id", "name", "description"],
        "properties": {
          "id": { "type": "string", "minLength": 1 },
          "name": { "type": "string", "minLength": 1 },
          "description": { "type": "string", "minLength": 1 },
          "bounds": { "$ref": "#/$defs/box" },
          "elements": {
            "type": "array",
            "items": { "type": "string" }
          }
        },
        "additionalProperties": true
      }
    }
  },
  "$defs": {
    "box": {
      "type": "object",
      "required": ["x", "y", "w", "h"],
      "properties": {
        "x": { "type": "number" },
        "y": { "type": "number" },
        "w": { "type": "number", "exclusiveMinimum": 0 },
        "h": { "type": "number", "exclusiveMinimum": 0 }
      },
      "additionalProperties": false
    }
  },
  "additionalProperties": true
}
